{
  "schemaVersion": 1,
  "id": "ENV-SPK-E-CONTENT-RENDERING-001",
  "kind": "environment",
  "os": "Fedora Linux 43 (Server Edition); Linux 7.1.3-101.fc43.x86_64 x86_64 GNU/Linux",
  "container": "not detected",
  "browsers": [
    {
      "family": "Chromium / Google Chrome (not executed by SPK-E)",
      "version": "150.0.7871.124",
      "executableSha256": "aea09d69ce7f24d5901f6bfb15dd44d0c856e793e0a498f8d8393ec7d2c308ec"
    },
    {
      "family": "Firefox (not executed by SPK-E)",
      "version": "152.0.4",
      "executableSha256": "12e361bb42c030a9ffa940c641ff3ddf53ea097d40a7b2ea4903cd2c954dcc2e"
    }
  ],
  "runtimes": {
    "python": "CPython 3.14.3 via tools/phase1-python",
    "renderer": "local Python 3 standard library plus approved PyYAML fixture parsing",
    "validator": "tools/validate-research.py through tools/phase1-python"
  },
  "packageManager": {
    "name": "pip",
    "version": "26.0"
  },
  "dependencies": [
    {
      "name": "PyYAML",
      "version": "6.0.3",
      "sha256": "c458b6d084f9b935061bc36216e8a69a7e293a2f1e68bf956dcd9e6cbcd143f5"
    },
    {
      "name": "jsonschema",
      "version": "4.26.0",
      "sha256": "d489f15263b8d200f8387e64b3c4a75f06629559fb73deb8fdfb525f2dab50ce"
    },
    {
      "name": "playwright",
      "version": "1.61.0",
      "sha256": "54f3b39f6eab832e33458c1dd7da0b5682aedab3b09ae731b5c59fa12fd2024e"
    }
  ],
  "environmentFlags": [
    "network=not-used",
    "browser-execution=not-used",
    "no-package-installation",
    "no-secrets",
    "no-destructive-state",
    "local-only /tmp generated representations",
    "non-production fixture; no application route or framework scaffold"
  ],
  "commandHashes": [
    {
      "command": "tools/phase1-python .planning/spikes/spk-e-content-rendering/render.py --fixture .planning/spikes/spk-e-content-rendering/fixture.yaml --out /tmp/spk-e-content-rendering",
      "sha256": "24bd8e33b0fad53bbedff283159d0c074e986d425851fa245160f097675c5def"
    },
    {
      "command": "tools/phase1-python tools/validate-research.py validate-spike .planning/spikes/spk-e-content-rendering --complete",
      "sha256": "e7a397976ce20dc347e8dce39e6aad7a6939dcd6bc89ec896bbcf5fbe51c8e86"
    },
    {
      "command": "tools/phase1-python tools/validate-research.py validate-report .planning/spikes/spk-e-content-rendering/report.md",
      "sha256": "1909b527347c3549a07cb2d984e0d65a5fdc3cb9e8e98b9267e887f96c4c026a"
    },
    {
      "command": "tools/phase1-python tools/validate-research.py validate --root .planning/research --report /tmp/spk-e-research-validation.md",
      "sha256": "134818ba95bbec94ae0dc195f1b84a906ba01c3e99a010509a6b994eff06e443"
    }
  ]
}
