{
  "schemaVersion": 1,
  "id": "ENV-SPK-F-COURSE-WORKBENCH-20260724",
  "kind": "environment",
  "os": "Linux 7.1.3-101.fc43.x86_64 x86_64 GNU/Linux",
  "container": "not detected",
  "browsers": [
    { "family": "chrome", "version": "150.0.7871.124", "executableSha256": "aea09d69ce7f24d5901f6bfb15dd44d0c856e793e0a498f8d8393ec7d2c308ec" },
    { "family": "firefox", "version": "152.0.4", "executableSha256": "12e361bb42c030a9ffa940c641ff3ddf53ea097d40a7b2ea4903cd2c954dcc2e" }
  ],
  "runtimes": {
    "node": "v22.22.0",
    "python": "Python 3.14.3",
    "phase1PythonSha256": "644981c1104123d43a8e2b4a9b5b0738ad790e6f80c2f712f185bfc76a5507e5"
  },
  "packageManager": { "name": "npm", "version": "10.9.4" },
  "dependencies": [
    { "name": "astro", "version": "7.1.3", "sha256": "bf3ff78baf8ec066d56d5ca414fa38ff2fecefa21c2aa69b5891bc03740aa41a" },
    { "name": "vitepress", "version": "1.6.4", "sha256": "da038b347065c4543eb794a52f552140451974804800d99e20f6d6e624200ac4" }
  ],
  "environmentFlags": [
    "CI=1",
    "NO_COLOR=1",
    "networkDuringMeasurement=false",
    "browserDownload=false",
    "nonProduction=true",
    "guestOnly=true",
    "packageLifecycleScripts=ignored"
  ],
  "commandHashes": [
    { "command": "fixture.md", "sha256": "f7f490d6dcc198b2358682e906979b9c366eed24174e846eb42531c750fcb690" },
    { "command": "run-spk-f.mjs", "sha256": "7fbe2fdb7fb2025db40d88381cda61617fbf60b537e5b7b2c07ca5baf5c826b0" },
    { "command": "five-build measurement output", "sha256": "52fb05708d01d9464f3aa8c7d0a067b8c128e743dce5fd77c0634128bb72aa19" },
    { "command": "direct-browser observation output", "sha256": "e3ec32253036c320679421f040cd47ec7198a6eb6b592c16f355194efcb3e7cd" }
  ]
}
