{
  "schemaVersion": 1,
  "id": "ENV-SPK-D-VERIFIED-LOADER-001",
  "kind": "environment",
  "os": "Fedora Linux 43 (Server Edition); Linux 7.1.3-101.fc43.x86_64 x86_64 GNU/Linux",
  "container": "not detected",
  "browsers": [
    {
      "family": "Chromium / Google Chrome (not executed by SPK-D)",
      "version": "150.0.7871.124",
      "executableSha256": "aea09d69ce7f24d5901f6bfb15dd44d0c856e793e0a498f8d8393ec7d2c308ec"
    },
    {
      "family": "Firefox (not executed by SPK-D)",
      "version": "152.0.4",
      "executableSha256": "12e361bb42c030a9ffa940c641ff3ddf53ea097d40a7b2ea4903cd2c954dcc2e"
    }
  ],
  "runtimes": {
    "python": "CPython 3.14.3 via tools/phase1-python",
    "fixtureIntegrity": "Python standard-library hashlib; digest comparison only",
    "validator": "tools/validate-research.py through tools/phase1-python"
  },
  "packageManager": {
    "name": "pip",
    "version": "26.0"
  },
  "dependencies": [
    {
      "name": "PyYAML",
      "version": "6.0.3",
      "sha256": "c458b6d084f9b935061bc36216e8a69a7e293a2f1e68bf956dcd9e6cbcd143f5"
    },
    {
      "name": "jsonschema",
      "version": "4.26.0",
      "sha256": "d489f15263b8d200f8387e64b3c4a75f06629559fb73deb8fdfb525f2dab50ce"
    },
    {
      "name": "playwright",
      "version": "1.61.0",
      "sha256": "54f3b39f6eab832e33458c1dd7da0b5682aedab3b09ae731b5c59fa12fd2024e"
    }
  ],
  "environmentFlags": [
    "network=not-used",
    "browser-execution=not-used",
    "no-package-installation",
    "no-secrets",
    "no-destructive-state",
    "fixture-integrity-only; no signature/blob/aggregate/manifest/identity verification"
  ],
  "commandHashes": [
    {
      "command": "tools/phase1-python -c fixture-integrity-only",
      "sha256": "6c2639cf5bab0e695158aec7545f561f3a522db61cd2685f950e628c626e155b"
    },
    {
      "command": "tools/phase1-python tools/validate-research.py validate-spike .planning/spikes/spk-d-verified-loader --complete",
      "sha256": "2966b367b4c3be1f4c3a7f97046cc9c94a5dc860559d195a9dd3f69ad732189e"
    },
    {
      "command": "tools/phase1-python tools/validate-research.py validate-report .planning/spikes/spk-d-verified-loader/report.md",
      "sha256": "82a794142c077d6cac387aae05729c97c3b6c3d781ab40984c0f955e3c37c7b3"
    }
  ]
}
