{
  "schemaVersion": 1,
  "id": "ENV-SPK-G-PACKAGE-CONFORMANCE-001",
  "kind": "environment",
  "os": "Fedora Linux 43 (Server Edition); Linux 7.1.3-101.fc43.x86_64 x86_64 GNU/Linux",
  "container": "not detected",
  "browsers": [
    {
      "family": "Chromium / Google Chrome (not executed by SPK-G)",
      "version": "150.0.7871.124",
      "executableSha256": "aea09d69ce7f24d5901f6bfb15dd44d0c856e793e0a498f8d8393ec7d2c308ec"
    },
    {
      "family": "Firefox (not executed by SPK-G)",
      "version": "152.0.4",
      "executableSha256": "12e361bb42c030a9ffa940c641ff3ddf53ea097d40a7b2ea4903cd2c954dcc2e"
    }
  ],
  "runtimes": {
    "python": "CPython 3.14.3 via tools/phase1-python",
    "node": "v22.22.0 (not used to install or import a package)",
    "validator": "tools/validate-research.py through tools/phase1-python",
    "blockedGate": "catalog and human-block inspection only; no external package code executed"
  },
  "packageManager": {
    "name": "npm",
    "version": "10.9.4"
  },
  "dependencies": [
    {
      "name": "PyYAML",
      "version": "6.0.3",
      "sha256": "c458b6d084f9b935061bc36216e8a69a7e293a2f1e68bf956dcd9e6cbcd143f5"
    },
    {
      "name": "jsonschema",
      "version": "4.26.0",
      "sha256": "d489f15263b8d200f8387e64b3c4a75f06629559fb73deb8fdfb525f2dab50ce"
    },
    {
      "name": "playwright",
      "version": "1.61.0",
      "sha256": "54f3b39f6eab832e33458c1dd7da0b5682aedab3b09ae731b5c59fa12fd2024e"
    }
  ],
  "environmentFlags": [
    "network=not-used",
    "browser-execution=not-used",
    "no-package-installation",
    "no-package-import",
    "no-private-or-deep-path",
    "no-secrets",
    "no-destructive-state",
    "human-decision=CAND-NAPPLET-WEB-PACKAGE-blocked-2026-07-24"
  ],
  "commandHashes": [
    {
      "command": "tools/phase1-python tools/validate-research.py validate-spike .planning/spikes/spk-g-package-conformance --contract",
      "sha256": "56ac1703b9452e7fb78eec443d7f62bc2b720e1f52b1c9102c1bdc3e395b3183"
    },
    {
      "command": "tools/phase1-python -c spk-g-blocked-package-gate",
      "sha256": "0b2ccfc42c623037bb866e3ce7632712c167c89ab2198deca1b68ac61b170de5"
    }
  ]
}
