{
  "schemaVersion": 1,
  "id": "ENV-SPK-H-BROWSER-EGRESS-001",
  "kind": "environment",
  "os": "Fedora Linux 43 (Server Edition); Linux 7.1.3-101.fc43.x86_64 x86_64",
  "container": "not detected",
  "browsers": [
    {
      "family": "Chromium / Google Chrome",
      "version": "150.0.7871.124",
      "executableSha256": "aea09d69ce7f24d5901f6bfb15dd44d0c856e793e0a498f8d8393ec7d2c308ec"
    },
    {
      "family": "Firefox",
      "version": "152.0.4",
      "executableSha256": "12e361bb42c030a9ffa940c641ff3ddf53ea097d40a7b2ea4903cd2c954dcc2e"
    }
  ],
  "runtimes": {
    "python": "CPython 3.14.3 via tools/phase1-python",
    "playwright": "1.61.0",
    "node": "v22.22.0"
  },
  "packageManager": {
    "name": "pip",
    "version": "26.0"
  },
  "dependencies": [
    {
      "name": "PyYAML",
      "version": "6.0.3",
      "sha256": "c458b6d084f9b935061bc36216e8a69a7e293a2f1e68bf956dcd9e6cbcd143f5"
    },
    {
      "name": "jsonschema",
      "version": "4.26.0",
      "sha256": "d489f15263b8d200f8387e64b3c4a75f06629559fb73deb8fdfb525f2dab50ce"
    },
    {
      "name": "playwright",
      "version": "1.61.0",
      "sha256": "54f3b39f6eab832e33458c1dd7da0b5682aedab3b09ae731b5c59fa12fd2024e"
    }
  ],
  "environmentFlags": [
    "headless=true",
    "direct-installed-browsers-only",
    "runner-added-browser-arguments=none",
    "playwright-managed-browser-downloads=not-requested",
    "network=deterministic-loopback-only",
    "loopback-bind=127.0.0.1:ephemeral",
    "output=/tmp/spk-h-browser-egress"
  ],
  "commandHashes": [
    {
      "command": "tools/phase1-python .planning/spikes/spk-h-browser-egress/runner.py --fixture .planning/spikes/spk-h-browser-egress/fixture.html --out /tmp/spk-h-browser-egress",
      "sha256": "690972593d5a7aa157298c3fe4cef92d1aa6c5cbdf10c6f390f57ec194903d0d"
    },
    {
      "command": "tools/phase1-python tools/validate-research.py validate-spike .planning/spikes/spk-h-browser-egress --complete",
      "sha256": "079a8fb99eb5eff93699aa55f9d654e87e694402ac7f6048e939451f8d0e3270"
    },
    {
      "command": "tools/phase1-python tools/validate-research.py validate-impact-fragment .planning/spikes/spk-h-browser-egress/impact-fragment.yaml --root .planning",
      "sha256": "aef0aef5167b2e2f2eae8fdf9673bbf974edca5d96d5f57c21ed74196365507b"
    }
  ]
}
