{
  "schemaVersion": 1,
  "id": "ENV-SPK-B-STATIC-FRAMEWORK-20260724",
  "kind": "environment",
  "os": "Linux 7.1.3-101.fc43.x86_64 x86_64 GNU/Linux",
  "container": "not-used",
  "browsers": [
    { "family": "chrome", "version": "150.0.7871.124", "executableSha256": "aea09d69ce7f24d5901f6bfb15dd44d0c856e793e0a498f8d8393ec7d2c308ec" },
    { "family": "firefox", "version": "152.0.4", "executableSha256": "12e361bb42c030a9ffa940c641ff3ddf53ea097d40a7b2ea4903cd2c954dcc2e" }
  ],
  "runtimes": {
    "node": "v22.22.0",
    "python": "Python 3.14.3",
    "phase1PythonSha256": "644981c1104123d43a8e2b4a9b5b0738ad790e6f80c2f712f185bfc76a5507e5"
  },
  "packageManager": { "name": "npm", "version": "10.9.4" },
  "dependencies": [
    { "name": "astro", "version": "7.1.3", "sha256": "bf3ff78baf8ec066d56d5ca414fa38ff2fecefa21c2aa69b5891bc03740aa41a" },
    { "name": "vitepress", "version": "1.6.4", "sha256": "da038b347065c4543eb794a52f552140451974804800d99e20f6d6e624200ac4" }
  ],
  "environmentFlags": ["CI=1", "NO_COLOR=1", "networkDuringMeasurement=false", "browserDownload=false", "nonProduction=true"],
  "commandHashes": [
    { "command": "fixture.md", "sha256": "24ee064159a14de4f0c9e6c8d3f9684fad1ace76920cb899d8fc614a5a24e503" },
    { "command": "astro build output", "sha256": "ec7e951d45a25fdcf0648263164a81e6709ade51ae8d9e3723bf3130b69eec94" },
    { "command": "vitepress build output", "sha256": "2948ebf6c8c59be0f82b95e945d7110c492d375d646cddb1cbde9cea49a69c26" }
  ]
}
