{
  "schemaVersion": 1,
  "id": "ENV-SPK-C-BOUNDARY-HARNESS-001",
  "kind": "environment",
  "os": "Fedora Linux 43 (Server Edition); Linux 7.1.3-101.fc43.x86_64 x86_64",
  "container": "not detected",
  "browsers": [
    {
      "family": "Chromium / Google Chrome",
      "version": "150.0.7871.124",
      "executableSha256": "aea09d69ce7f24d5901f6bfb15dd44d0c856e793e0a498f8d8393ec7d2c308ec"
    },
    {
      "family": "Firefox",
      "version": "152.0.4",
      "executableSha256": "12e361bb42c030a9ffa940c641ff3ddf53ea097d40a7b2ea4903cd2c954dcc2e"
    }
  ],
  "runtimes": {
    "python": "CPython 3.14.3 via tools/phase1-python",
    "playwright": "1.61.0",
    "node": "v22.22.0"
  },
  "packageManager": {
    "name": "pip",
    "version": "26.0"
  },
  "dependencies": [
    {
      "name": "PyYAML",
      "version": "6.0.3",
      "sha256": "c458b6d084f9b935061bc36216e8a69a7e293a2f1e68bf956dcd9e6cbcd143f5"
    },
    {
      "name": "jsonschema",
      "version": "4.26.0",
      "sha256": "d489f15263b8d200f8387e64b3c4a75f06629559fb73deb8fdfb525f2dab50ce"
    },
    {
      "name": "playwright",
      "version": "1.61.0",
      "sha256": "54f3b39f6eab832e33458c1dd7da0b5682aedab3b09ae731b5c59fa12fd2024e"
    }
  ],
  "environmentFlags": [
    "headless=true",
    "direct-installed-browsers-only",
    "playwright-managed-browser-downloads=not-requested"
  ],
  "commandHashes": [
    {
      "command": "tools/phase1-python .planning/spikes/spk-c-boundary-harness/runner.py",
      "sha256": "ee0fd8210a3344731df4377a7372be2468c8d9ca5602c1fecb64532cc736294c"
    },
    {
      "command": "tools/phase1-python tools/validate-research.py validate-spike .planning/spikes/spk-c-boundary-harness --complete",
      "sha256": "229e6062d73d68ceaec269ef58c5a65146c2f298fe8da5714f194edb67fa7937"
    }
  ]
}
