{
  "schemaVersion": 1,
  "id": "ENV-SPK-L-SOURCE-FRESHNESS",
  "kind": "environment",
  "os": "Linux-7.1.3-101.fc43.x86_64-x86_64-with-glibc2.42",
  "container": "local disposable Phase 1 replay; no container image",
  "browsers": [
    {"family": "not-used-local-fixture", "version": "not-applicable", "executableSha256": "0000000000000000000000000000000000000000000000000000000000000000"}
  ],
  "runtimes": {"python": "3.14.3"},
  "packageManager": {"name": "pip", "version": "isolated phase1-tools recorded by tools/phase1-python"},
  "dependencies": [
    {"name": "PyYAML", "version": "6.0.3", "sha256": "0000000000000000000000000000000000000000000000000000000000000000"},
    {"name": "jsonschema", "version": "4.26.0", "sha256": "0000000000000000000000000000000000000000000000000000000000000000"}
  ],
  "environmentFlags": ["local-fixtures-only", "no-network", "canonical-records-read-only"],
  "commandHashes": [
    {"command": "tools/refresh-sources.py", "sha256": "4ce1310f6b6d986b095722b7f6043a639349c58c8eb78914e26139625c20f66e"},
    {"command": "tools/phase1-python", "sha256": "644981c1104123d43a8e2b4a9b5b0738ad790e6f80c2f712f185bfc76a5507e5"}
  ]
}
